<?xml version="1.0"?>
<!DOCTYPE list PUBLIC "-//MMBase/DTD editwizard 1.0//EN" "http://www.mmbase.org/dtd/wizard-schema_1_0.dtd">
<list role="contentrel" destination="contentelement" minoccurs="0" maxoccurs="*"
	orderby="field[@name='pos']" ordertype="number">
	<title xml:lang="nl">Content element</title>
	<title xml:lang="en">Content element</title>
	<title xml:lang="zh">内容元素</title>

	<item>
		<field ftype="data" name="title">
			<prompt xml:lang="en">Title</prompt>
			<prompt xml:lang="nl">Titel</prompt>
			<prompt xml:lang="zh">标题</prompt>
		</field>
	</item>
	
	<command name="search" nodepath="contentelement" age="-1"
		fields="title,description,source,editor_note">
		<prompt xml:lang="en">Search content element</prompt>
		<prompt xml:lang="nl">Zoek content element</prompt>
		<prompt xml:lang="zh">查找内容元素</prompt>
		<search-filter>
			<name xml:lang="en">Title contains</name>
			<name xml:lang="nl">Titel bevat</name>
			<name xml:lang="zh">标题包含</name>
			<search-fields>[title]</search-fields>
		</search-filter>
		<search-filter>
			<name xml:lang="en">Description contains</name>
			<name xml:lang="nl">Omschrijving bevat</name>
			<name xml:lang="zh">描述包含</name>
			<search-fields>[description]</search-fields>
		</search-filter>
		<search-filter>
			<name xml:lang="en">Source contains</name>
			<name xml:lang="nl">Bronvermelding bevat</name>
			<name xml:lang="zh">资源包含</name>
			<search-fields>[source]</search-fields>
		</search-filter>
		<search-filter>
			<name xml:lang="en">Note contains</name>
			<name xml:lang="nl">Notitie bevat</name>
			<name xml:lang="zh">注释包含</name>
			<search-fields>[editor_note]</search-fields>
		</search-filter>
	</command>

	<action type="create">
		<relation destinationtype="contentelement" role="contentrel">
			<field name="pos">{sum(//relation[@role='contentrel' and @lastitem='true']/object[@type='contentelement']/../field[@name='pos'])+{$pos}}</field>
		</relation>
	</action>
</list>