<?xml version="1.0"?>
<!DOCTYPE wizard-schema PUBLIC "-//MMBase//DTD editwizard 1.0//EN" "http://www.mmbase.org/dtd/wizard-schema_1_0.dtd">
<wizard-schema id="_create">
  <title xml:lang="nl">Topics</title>

  <action type="create">
    <object type="categories">
      <field name="title" />
      <field name="visible">1</field>
      <field name="end">4102441257</field>
    </object>
  </action>

  <lists include="tasks/sitestatlists.xml" />

  <form-schema extends="tasks/categories/schema.xml" id="basics" >

    <list include="tasks/categorytypes/list.xml" />

  </form-schema>
</wizard-schema>
