<?xml version="1.0"?>
<!DOCTYPE optionlist PUBLIC "-//MMBase/DTD editwizard 1.0//EN" "http://www.mmbase.org/dtd/wizard-schema_1_0.dtd">
<optionlist name="ImageCrop">
   <option id="">
      <prompt xml:lang="nl">Niet afsnijden</prompt>
      <prompt xml:lang="en">Do not crop</prompt>
   </option>
   <option id="begin">
      <prompt xml:lang="nl">Begin</prompt>
      <prompt xml:lang="en">Begin</prompt>
   </option>
   <option id="middle">
      <prompt xml:lang="nl">Midden</prompt>
      <prompt xml:lang="en">Middle</prompt>
   </option>
   <option id="end">
      <prompt xml:lang="nl">Eind</prompt>
      <prompt xml:lang="en">End</prompt>
   </option>
</optionlist>