<!DOCTYPE list PUBLIC "-//MMBase/DTD editwizard 1.0//EN" "http://www.mmbase.org/dtd/wizard-schema_1_0.dtd">
<list destination="attachments" role="related" minoccurs="0" maxoccurs="*">
    <title>Bijbehorende Bestanden</title>

    <item>
        <field name="title" ftype="data">
            <prompt>Titel</prompt>
        </field>
        <field ftype="data" name="description">
            <prompt>Omschrijving</prompt>
        </field>
        <field wizardname="config/attachment/attachment" ftype="startwizard" />
   </item>

    <command name="startwizard" inline="true" wizardname="config/attachment/attachment" objectnumber="new" />

    <command name="search" nodepath="attachments" fields="title" age="-1" orderby="number" directions="down" >
        <prompt>Zoeken naar bestand</prompt>
        <search-filter>
            <name>Titel bevat</name>
            <search-fields>title</search-fields>
        </search-filter>
        <search-filter>
            <name>Omschrijving bevat</name>
            <search-fields>description</search-fields>
        </search-filter>
    </command>

    <action type="create">
        <relation destinationtype="attachments" role="related" />
    </action>
</list>
