<!DOCTYPE list PUBLIC "-//MMBase/DTD editwizard 1.0//EN" "http://www.mmbase.org/dtd/wizard-schema_1_0.dtd">
<list role="descriptionrel" destinationtype="flashpages"  minoccurs="0" maxoccurs="*" searchdir="both"> 
    <title>Bijbehorende flash paginas</title>
    <item>
        <field name="name" ftype="data">
            <prompt>Naam</prompt>
            <description>Naam van de flashpagina</description>
        </field>
        <field fdatapath="field[@name='description']" ftype="line"><prompt>Omschrijving van de link</prompt></field> 
        <field wizardname="config/flashpages/flashpages" ftype="startwizard" />
    </item>

    <action type="create">
        <relation role="descriptionrel" destinationtype="flashpages">
        </relation>
    </action>

    <command name="startwizard" inline="true" wizardname="config/flashpages/flashpages" objectnumber="new">
      <prompt>Nieuwe flash pagina
      </prompt>
    </command>
     <command name="search" nodepath="flashpages" fields="name" age="-1" orderby="number" directions="down" >
        <prompt>Zoeken naar flash paginas</prompt>
        <search-filter>
            <name>Naam bevat</name>
            <search-fields>name</search-fields>
        </search-filter>
   </command>
</list>

