<?xml version="1.0"?>
<!DOCTYPE wizard-schema PUBLIC "-//MMBase/DTD editwizard 1.0//EN" "http://www.mmbase.org/dtd/wizard-schema_1_0.dtd">
<wizard-schema id="empty">
    <title>Leerobject Editor</title>

    <action type="create">
        <object type="learnobjects">
            <field name="showtitle">1</field>
        </object>
    </action>
    
    <action type="load">
        <relation destination="mmevents" role="related" />
        <relation destination="competencies" role="needcomp" />
        <relation destination="competencies" role="developcomp" />
    </action>

    <action type="delete" />
    
    <lists>
       <optionlist include="option_lists/boolean.xml" />
   </lists>

    <steps>
        <step form-schema="step1" />
        <step form-schema="step2" />
    </steps>

    <form-schema id="step1">
        <title>Leerobject invoeren</title>
        <field name="name" >
            <prompt>Naam</prompt>
        </field>

      <field name="showtitle" ftype="enum">
         <prompt xml:lang="nl">Titel laten zien</prompt>
         <prompt xml:lang="en">Show title</prompt>
         <optionlist select="boolean" />
      </field>
 

        <field name="intro" ftype="html" dtminlength="0">
            <prompt>Tekst</prompt>
        </field>

        <list role="related" extends="config/online/online-list.xml" />
    </form-schema>

    <form-schema id="step2">
        <title>Competenties invoeren</title>
        <field name="name" ftype="data"/>
        <list extends="config/competency/needcompetencies-list.xml"/>
        <list extends="config/competency/developcompetencies-list.xml"/>
    </form-schema>

</wizard-schema>
